<?xml version="1.0" encoding="UTF-8"?>
<!DOCTYPE taller SYSTEM "ejemplo09.dtd">
<taller>
    <coche matricula="MAT-1001BVC" fecha_entrada="2023-10-01"
        fechas_revisiones="2021-01-25 2022-01-28 2023-02-05">
        <marca>Kia</marca>
        <modelo>Stonic</modelo>
    </coche>

    <coche matricula="MAT-8329GHA" fecha_entrada="2023-10-01"
        fechas_revisiones="2021-01-25 2022-01-28 2023-02-05">
        <marca>Kia</marca>
        <modelo>Stonic</modelo>
    </coche>

    <reparacion mat_vehiculo="MAT-8329GHA">
        <concepto>Pinchazo rueda trasera izquiera</concepto>
        <precio>10</precio>
    </reparacion>
</taller>